{
  "$schema": "https://json-schema.org/draft/2020-12/schema",
  "title": "PricingRequest",
  "type": "object",
  "required": ["InstrumentKey", "UnwindMapRaw", "RiskFactorKeys", "MarketDataSnapshot", "UpdatedLifecycle", "parameters"],
  "properties": {
    "InstrumentKey": {"$ref": "instrument_key.schema.json"},
    "UnwindMapRaw": {"$ref": "unwind_map_raw.schema.json"},
    "RiskFactorKeys": {"type": "array", "minItems": 1, "items": {"$ref": "risk_factor_key.schema.json"}},
    "MarketDataSnapshot": {"$ref": "market_data_snapshot.schema.json"},
    "UpdatedLifecycle": {"$ref": "updated_lifecycle.schema.json"},
    "CommonEconomics": {
      "type": "object",
      "properties": {
        "notional": {"type": "number", "exclusiveMinimum": 0},
        "payment_currency": {"type": "string"},
        "discount_rate": {"type": "number"},
        "currency_conversion": {"type": "number", "exclusiveMinimum": 0}
      },
      "additionalProperties": false
    },
    "Legs": {
      "type": "array",
      "items": {
        "type": "object",
        "required": ["leg_id", "name", "leg_type"],
        "properties": {
          "leg_id": {"type": "integer"},
          "name": {"type": "string"},
          "leg_type": {"enum": ["intrinsic_option", "funding", "coupon"]},
          "notional": {"type": "number", "exclusiveMinimum": 0},
          "sign": {"enum": ["long", "short"]},
          "option_type": {"enum": ["call", "put"]},
          "strike": {"type": "number", "exclusiveMinimum": 0},
          "strike_ratio": {"type": "number", "exclusiveMinimum": 0},
          "settlement": {"enum": ["cash", "delivery"]},
          "coupon_rate": {"type": "number"},
          "memory": {"type": "boolean"},
          "observations": {"type": "integer", "minimum": 1},
          "observation_count": {"type": "integer", "minimum": 1},
          "pay_if_ki": {"type": "boolean"},
          "ki_enabled": {"type": "boolean"},
          "already_knock_in": {"type": "boolean"},
          "ki_monitoring": {"enum": ["EKI", "AKI"], "default": "AKI"},
          "global_ko": {
            "type": "object",
            "properties": {
              "enabled": {"type": "boolean"},
              "locked": {"type": "boolean"},
              "date": {"type": "string", "format": "date"},
              "effective_date": {"type": "string", "format": "date"}
            },
            "additionalProperties": false
          },
          "barriers": {"type": "array", "items": {"$ref": "#/definitions/barrier"}},
          "observation_dates": {"type": "array", "items": {"type": "string", "format": "date"}},
          "payment_dates": {"type": "array", "items": {"type": "string", "format": "date"}},
          "schedule": {
            "type": "object",
            "properties": {
              "observation_dates": {"type": "array", "items": {"type": "string", "format": "date"}},
              "payment_dates": {"type": "array", "items": {"type": "string", "format": "date"}},
              "fixing_dates": {"type": "array", "items": {"type": "string", "format": "date"}}
            },
            "additionalProperties": false
          }
        },
        "additionalProperties": false
      }
    },
    "parameters": {
      "type": "object",
      "required": ["eval_datetime", "expiry"],
      "properties": {
        "eval_datetime": {"type": "string", "format": "date"},
        "expiry": {"type": "string", "format": "date"},
        "option_type": {"enum": ["call", "put"]},
        "payoff_type": {"enum": ["vanilla", "barrier", "autocall", "fcn"]},
        "barriers": {"type": "array", "items": {"type": "object", "properties": {"direction": {"enum": ["up", "down"]}, "event": {"enum": ["KI", "KO"]}, "level": {"type": "number", "exclusiveMinimum": 0}, "level_type": {"enum": ["relative_initial", "absolute"], "default": "relative_initial"}, "monitoring": {"enum": ["global", "local"]}, "observation_dates": {"type": "array", "items": {"type": "string"}}, "rebate": {"type": "number"}}, "additionalProperties": true}},
        "accrual": {"type": ["object", "null"], "properties": {
          "coupon_rate": {"type": "number"}, "memory": {"type": "boolean"},
          "observation_frequency": {"enum": ["daily", "weekly", "monthly"]},
          "observations": {"type": "integer", "minimum": 1}, "pay_if_ki": {"type": "boolean"},
          "n1": {"type": "array", "items": {"type": "integer", "minimum": 0}},
          "n2": {"type": "array", "items": {"type": "integer", "minimum": 1}},
          "fixed_n1_periods": {"type": "integer", "minimum": 0},
          "period_coupon_rates": {"type": "array", "items": {"type": "number"}},
          "accruals": {"type": "array", "items": {"type": "number"}},
          "payment_dates": {"type": "array", "items": {"type": "string", "format": "date"}},
          "range_lower": {"type": "number", "exclusiveMinimum": 0},
          "range_upper": {"type": "number", "exclusiveMinimum": 0},
          "range_level_type": {"enum": ["absolute", "relative_initial"]}
        }, "additionalProperties": true},
        "risk_free_rate": {"type": "number"},
        "dividend_yield": {"type": "number"},
        "volatility": {"type": "number", "exclusiveMinimum": 0},
        "volatility_mode": {"enum": ["constant", "forward"], "default": "constant"},
        "svi": {"type": ["object", "null"], "properties": {"a": {"type": "number", "exclusiveMinimum": 0}, "b": {"type": "number", "exclusiveMinimum": 0}, "rho": {"type": "number", "exclusiveMinimum": -1, "exclusiveMaximum": 1}, "m": {"type": "number"}, "sigma": {"type": "number", "exclusiveMinimum": 0}}, "required": ["a", "b", "rho", "m", "sigma"], "additionalProperties": false},
        "paths": {"type": "integer", "minimum": 1000},
        "steps": {"type": "integer", "minimum": 2},
        "seed": {"type": "integer"},
        "bump_size": {"type": "number", "exclusiveMinimum": 0, "default": 0.01},
        "bump_mode": {"enum": ["relative", "absolute"]},
        "currency_conversion": {"type": "number", "exclusiveMinimum": 0},
        "smooth_barrier": {"type": "boolean", "default": false},
        "barrier_smoothing_width": {"type": "number", "exclusiveMinimum": 0, "maximum": 0.25, "default": 0.01},
        "basket_method": {"enum": ["worst_of", "best_of"], "default": "worst_of"},
        "correlation": {"type": ["array", "null"], "items": {"type": "array", "items": {"type": "number"}}}
      },
      "additionalProperties": true
    }
  },
  "definitions": {
    "barrier": {
      "type": "object",
      "required": ["direction", "event", "level"],
      "properties": {
        "direction": {"enum": ["up", "down"]},
        "event": {"enum": ["KI", "KO"]},
        "level": {"type": "number", "exclusiveMinimum": 0},
        "level_type": {"enum": ["relative_initial", "absolute"]},
        "monitoring": {"enum": ["global", "local"]},
        "observation_dates": {"type": "array", "items": {"type": "string", "format": "date"}},
        "rebate": {"type": "number"}
      },
      "additionalProperties": true
    }
  },
  "additionalProperties": false
}
