{
  "InstrumentKey": {
    "isin": "US_AAPL_TSLA_FCN",
    "name": "AAPL_TSLA_WORST_OF_FCN",
    "strategy_id": "STRATEGY_FCN_001",
    "product_type": "FCN",
    "family": "EQD",
    "group": "OPT",
    "leg_id": 1,
    "leg_name": "PUT",
    "notional": 770000.0,
    "payment_currency": "USD",
    "status": "LIVE"
  },
  "UnwindMapRaw": {
    "underlyings": [
      {
        "name": "AAPL US",
        "currency": "HKD",
        "spot": 200.0,
        "strikePrice": 200.0,
        "barrierPrice": 0.8,
        "barriers": [{"direction": "down", "event": "KI", "level": 0.80, "level_type": "relative_initial", "monitoring": "global", "observation_dates": [], "rebate": 0.0}],
        "fx_pair": "USDHKD",
        "calendar": "EXCH HKG",
        "time": "1600",
        "time_zone": "Hong Kong"
      },
      {
        "name": "TSLA US",
        "currency": "HKD",
        "spot": 250.0,
        "strikePrice": 200.0,
        "barrierPrice": 0.8,
        "barriers": [{"direction": "down", "event": "KI", "level": 0.70, "level_type": "relative_initial", "monitoring": "global", "observation_dates": [], "rebate": 0.0}],
        "fx_pair": "USDHKD",
        "calendar": "EXCH HKG",
        "time": "1600",
        "time_zone": "Hong Kong"
      }
    ]
  },
  "RiskFactorKeys": [
    {
      "type": "Spot",
      "underlying": "AAPL US"
    },
    {
      "type": "Spot",
      "underlying": "TSLA US"
    },
    {
      "type": "Volatility",
      "underlying": "AAPL US"
    },
    {
      "type": "Volatility",
      "underlying": "TSLA US"
    },
    {
      "type": "InterestRate",
      "underlying": "USD"
    }
  ],
  "MarketDataSnapshot": {
    "spot_data": [
      {
        "rfk": {
          "underlying": "AAPL US"
        },
        "value": 200.0
      },
      {
        "rfk": {
          "underlying": "TSLA US"
        },
        "value": 250.0
      }
    ],
    "vol_data": [
      {
        "rfk": {
          "underlying": "AAPL US"
        },
        "value": 0.3
      },
      {
        "rfk": {
          "underlying": "TSLA US"
        },
        "value": 0.45
      }
    ],
    "ir_data": [
      {
        "rfk": {
          "currency": "USD",
          "tenor": "5Y"
        },
        "value": 0.03
      }
    ],
    "fx_data": [
      {
        "rfk": {
          "currency_pair": "USDHKD"
        },
        "value": 7.8
      }
    ]
  },
  "UpdatedLifecycle": {
    "instrument_state": "LIVE",
    "applied_fixings": [
      "2027-05-18"
    ],
    "adjusted_underlyings": [
      {
        "name": "AAPL US",
        "adjustment_factor": 1.0
      },
      {
        "name": "TSLA US",
        "adjustment_factor": 1.0
      }
    ]
  },
  "parameters": {
    "eval_datetime": "2027-05-18",
    "expiry": "2028-05-25",
    "option_type": "put",
    "payoff_type": "fcn",
    "accrual": {
      "coupon_rate": 0.12,
      "memory": true,
      "observation_frequency": "monthly",
      "observations": 12,
      "pay_if_ki": true
    },
    "risk_free_rate": 0.03,
    "dividend_yield": 0.0,
    "volatility": 0.35,
    "paths": 4000,
    "steps": 48,
    "seed": 42,
    "bump_size": 0.01,
    "bump_mode": "relative",
    "currency_conversion": 1.0,
    "correlation": [
      [
        1.0,
        0.5
      ],
      [
        0.5,
        1.0
      ]
    ],
    "basket_method": "worst_of",
    "barriers": []
  }
}
